subreddit,title,selftext
TheHobbit,The Complete SECOND AGE of Middle-earth Timeline | Middle-Earth Lore,
TheHobbit,Rings of Power Playlist - full of Middle-Earth vibe and music in tribute to the upcoming series,
TheHobbit,Tolkien taught us Physics,"5am thoughts brought to you by Tolkien loving insomniac edition 6,722

Realistically our entire theory of our universe has moved (through string theory) into essentially an understanding/hypothesizing that our entire universe follows the principles of music 

Essentially the mind of the creator is the music of the universe 

Now WHO do we know that literally wrote an entire mythos based off the ideology that the music of the creator was the literal embodiment of the physical universe of the mythos?

Tolkien was a gift to humanity and was so far ahead of his time he essentially postulated string theory and presented it to society (in a way that laymen could actually fathom) well before we could prove any of it 🤷‍♀️"
TheHobbit,It took a while to get here but it was worth it 😍,
TheHobbit,Are there any more Audiobooks like The Hobbit by Bluefax,if there are any please send for all of the books of middle earth
TheHobbit,This piece exceeded my expectations,
TheHobbit,Como hacer CASA HOBBIT - Agujero Hobbit - Facil y rapido,
TheHobbit,The Hobbit - Book Ending,
TheHobbit,Lord of the Rings' Amazon Prime's Rings of Power Trailer First Reaction &amp; Review,
TheHobbit,The Lord of the Rings: The Rings of Power – Main Teaser Trailer BREAKDOWN! | The Rings of Power,
TheHobbit,Hobbiton: The Lord Of The Rings &amp; Hobbit Movie Set,
TheHobbit,why did azog hate thorin so much?,"As the title says. What did that orc hate thorin for, so much hatred?"
TheHobbit,The Hobbit Trilogy Extended Edition Box Set,Does anyone know if the The Hobbit Trilogy Extended Edition Box Set that folds out is available for purchase online? I have not been able to locate one. Both Amazon and Barnes and Noble appeared to have it but they are in fact the cheaper set that does not have the fold out box.
TheHobbit,Tom Bombadil… what do you believe?,
TheHobbit,The Hobbit J.R.R. Tolkien,Does Tolkien ever give references or compare situations in The Hobbit to present-day things? Like phones?
TheHobbit,What Was SAURON Actually Doing During The Lord of the Rings? | Middle-Earth Lore,
TheHobbit,The Hobbit tattoo sleeve help needed!,"Hello all! I am looking for some help bringing my vision to life, my artist doesn't understand the references and I want to throughly bring my idea together!

I want to have the focal point be The Hobbit hole with Rivendell, Mirkwood (Bilbo above the trees with the butterflies), Lake Town and The Lonely Mountain behind it (see first photo for reference!). Outside of that I'm looking for ideas of smaller elements to incorporate into my arm sleeve. For example an acorn, JRR's initials, Smaug above the mountain, Sting, elvish, etc! I've just started putting this together and I'd be happy to hear any and all recommendations! 

For reference, this would be on my right arm. It'll be full color and several sessions. Nothing is out of the question! :)"
TheHobbit,The Hobbit tattoo help needed!,
TheHobbit,I’m hosting a hobbit party next week and I need ideas for the decoration!! Any ideas here?,
TheHobbit,The Hobbit by J.R.R. Tolkien. Unpublished version - full leather binding,
TheHobbit,Trying to find a fan edit,"Hello there,  
i am trying to find a fan-edit of the hobbit films. The m4 fan-edit seems quite popular and not abandoned, but I can find it nowhere. Can someone please send me a link.  
Thank you"
TheHobbit,Silmarillion Podcast: Of the Silmarils &amp; why the House of Finwe ought to have been on Jerry Springer,
TheHobbit,Could MORGOTH Have Returned During the War of the Ring? | Middle-Earth Lore,
TheHobbit,Sauron tattoo by Boris from Vienna.,
TheHobbit,ENTS &amp; TAR-MIRIEL?! The Rings of Power Prime Exclusive Sneak Peek Breakdown! | The Rings of Power,
TheHobbit,Anyone else seen this rubber duck,
TheHobbit,I believe I have acquired the greatest poster of all time...,
TheHobbit,The Hobbit piano medley I made,
TheHobbit,The Hobbit Read-a-long,[removed]
TheHobbit,How Are URUK-HAI Different From Orcs? | Middle-Earth Lore,
TheHobbit,"I have a book of the Hobbit by George Allen &amp; Unwin Ltd 1975, but I can't find it online to see if it is worth anything. Can anyone help me?",
TheHobbit,Just wanted to pop in and introduce you guys to my own little Kíli!,
TheHobbit,This is our Barrels out of Bond display board! You can find more photos on Instagram @endoremodels,
TheHobbit,"👑79.city| Play Here, Win Here👑 Welcome to the Global Blockchain FREE 3 Spin Everyday Lottery Platform!🤑 Make ur deposit QUICK and SIMPLE💳 ®️REGISTER IT NOW®️ 79.city",[removed]
TheHobbit,Love that design.,
TheHobbit,Frodo Executes Order 66,
TheHobbit,12 Great Men of Middle Earth: Elros Tar Minyatar the Greatest of the Kings of Numenor,
TheHobbit,"The Hobbit, The Hill","Hi, i just started reading The Hobbit. In the first chapter it is said that Hobbits live in The Hill. What is meant with: Under The Hill, over The Hill and across The Water?"
TheHobbit,"The hobbit, The Hill",
TheHobbit,Pest Control Humble TX - Exterminator- Inspection - FullScope Pest Control,
TheHobbit,Absolutely fantastic piece! Artwork is beautiful :),
TheHobbit,Absolutely fantastic piece! Artwork is beautiful :),
TheHobbit,My collection of LOTR Number Plates around the world - updated with a few more plates (73 pics),
TheHobbit,I got this for a friend as a gift and she loved it !,
TheHobbit,"Watched TLOTR trilogy many times, finally decided to watch “The Hobbit” today",[removed]
TheHobbit,This is such a beautiful pieces!! better than i imagined,
TheHobbit,What Is DRAGON SICKNESS? | Middle-Earth Lore,
TheHobbit,"What is everyone's faverote scene out of all 3 ""the hobbit"" movies",Mine is in desolation of smaug where Thorin runs at Smaug with w wheelbarrow honestly always entertaining in my opinion
TheHobbit,I absolutely love the shirt!,
TheHobbit,Tales of the Rings Teaser,
TheHobbit,First Reaction to the Lord of the Rings Prequel Rings of Power's Orcs -Goblins Pictures,
TheHobbit,Print came out so gorgeous!,
TheHobbit,"In your opinion, which Middle-Earth film is your favorite?",
TheHobbit,The Hobbit Fire and Death,
TheHobbit,"What do you guys prefer, The Hobbit M4 Edit, Maple, Bilbo Edition, Back and Again, Spence Edit or The Original Two-Film Structure? Wanna know your opinions about them, which you prefer and why!",
TheHobbit,Ink illustractions for the Hobbit. Thinking about making part 2 of this,
TheHobbit,Fans Have Always Wanted a Story Like LOTR: The Rings of Power Says Co-Creator,
TheHobbit,Creators Of The Lord Of The Ring Series On Amazon Assert That They Do Not Contend With Peter Jackson,
TheHobbit,We Have A NEW Tolkien Book! THE FALL OF NÚMENOR! | Middle-Earth News,
TheHobbit,Tell us how you really feel..,
TheHobbit,"Introducing r/LoTRTavern, the r/StarWarsCantina for Lord of the Rings fans!","Hey, everybody! I wanted to announce that r/LoTRTavern now exists for you Lord of the Rings fans out there like myself who want a community with an emphasis on positivity and open-mindedness! Feel free to join and help me get it started, I'd love to have you guys!

Justin"
TheHobbit,This is such a beautiful pieces!! better than i imagined!,
TheHobbit,What Are The Most Powerful &amp; Iconic OTHER WEAPONS in Middle-earth? | Middle Earth Lore,
TheHobbit,I'm going on an adventure!,"Just about to ditch my job, toss most of my stuff in the trash, and fly off to Thailand for a job that pays moderately well enough to live moderately comfortably. This will be my first time ever to live outside of my home country and my first time ever traveling overseas on my own.

As Bilbo Baggins said, ""I'm going on an adventure!"""
TheHobbit,War of the Rohirrim Cast Announcement Reaction Video &amp; MORE!,
TheHobbit,How to paint Dwarf Ranger (Scibor Miniatures),
TheHobbit,Como hacer LIBROS en miniatura FACIL y RAPIDO,
TheHobbit,Check out SlushiesRUsCanada's video! #TikTok,
TheHobbit,Why didn’t Gandalf teleported them to the mountains or even ride the big birds?,[removed]
TheHobbit,The Hobbit Book Page Error,"Wondering if anyone else has a similar issues. Re-reading The Hobbit and noticed that Chapter XII “inside information” has one page and then the next page is from “Riddles in the Dark”. Riddles In the dark continues and is followed by out of the frying pan and queer lodgings. After Queer lodgings it switches back to Chapter XV “the gathering clouds”, essentially skipping a few chapters. Anyone else have a version like this?"
TheHobbit,It's totally perfect for my wall,
TheHobbit,who’s your favorite dwarf out of the company?,mine is Bofur. such a wholesome lad.
TheHobbit,The Lord of the Rings: THE WAR OF THE ROHIRRIM Cast Announcements!!,
TheHobbit,We made this teeny tiny hobbit home in epoxy resin!,
TheHobbit,i recently finished rewatching the trilogy and a question struck my mind.,"Could smaug unite the seven armies of the dwarves using the arkenstone? And if he could, what would he use it for"
TheHobbit,"Tolkien Podcast: An Examination of the 'Eucharist' Bread of LOTR - The Lembas, the Elves' Waybread",
TheHobbit,Bilbo and smuag,
TheHobbit,This is above and beyond what I expected,
TheHobbit,Why Did GANDALF Choose BILBO BAGGINS For The Hobbit Adventure? | Middle-Earth Lore,
TheHobbit,I know they aren't great but damn it I love The Hobbit Trilogy for what it is,
TheHobbit,The Lord of the Rings™: Return to Moria™ - Official Announcement Trailer,
TheHobbit,"As early as 1995 people were discussing cast for future Tolkien movies in Usenet newsgroups, well before the name of Peter Jackson was associated to them... Let's have a closer look!",
TheHobbit,The official account of LOTR in the Arab world says there will be no political agenda in The rings of power agenda,"&amp;#x200B;

https://preview.redd.it/uzcknjby8w491.png?width=743&amp;format=png&amp;auto=webp&amp;s=eee4ac6fffa13435edc40f402ea24d57ca3722f9"
TheHobbit,I found these amazing songs on YouTube for the Hobbit books. Ive been listening to them as I reread the books. I recommend that you guys check them out! They really bring life to the songs in the book.,
TheHobbit,About the hobbit book,So I’m in going into eighth grade this year and I’m wondering if it is a very hard read or if it is okay. I tried reading the first chapter at the library and it was kinda hard to read. Is the whole book like that? I want to read it because it sounds interesting but do you think I’ll just stop reading it?
TheHobbit,What’s your favourite scene from the three hobbits,
TheHobbit,Any advice on a starter collected,
TheHobbit,Who else though Bilbo betrayed thorin,
TheHobbit,My boyfriend loved this so much.,
TheHobbit,I took a look at how The Hobbit was adapted for the video game in both gameplay and story,
TheHobbit,Lord of the Rings Rings of Power First Reaction to the 4 new posters,
TheHobbit,What Are The Most Powerful &amp; Iconic BOWS AND ARROWS in Middle-earth? | Middle Earth Lore,
TheHobbit,Huida de la Ciudad de los Trasgos DIORAMA - El Hobbit - El señor de los ...,
TheHobbit,My most fab this one!!,
TheHobbit,This is the greatest print I will ever found!!,
TheHobbit,"I mad an edit earlier, I present to you…Ballin’",
TheHobbit,"battle of the 5 armies all Legos. ( not my picture, creditor unknown)",
TheHobbit,Tried my hand at wood burning/carving with a map of middle earth!,
TheHobbit,I was going through all my movie tickets and found this.,
TheHobbit,Silmarillion Podcast: of the Unchaining of Melkor,
TheHobbit,Anywhere I can still listen to bluefax audiobook?,I listened to it a few years ago and I loved it. I came back to listen to it today and saw that it had been taken down. I have searched all over the internet for it but I can't find any working links. If anyone could help me find a working link it would be much appreciated. It breaks my heart that something he put so much time and work into was taken down like that.
TheHobbit,"Gimli, realistic tattoo work by Ben Kaye from Orewa, New Zealand.",
TheHobbit,This is above and beyond what I expected,
TheHobbit,"You may have heard of Bilbo Baggins, but have you heard of Birbo Baggins?",
TheHobbit,Marvel Marketing | Online Marketing &amp;amp; Advertising Agency,
TheHobbit,"In this video I share with you my passion for books, especially Tolkien ones, and explain why I think they are more powerful than anything else, more beneficial, and how they make you Master of Time.",
TheHobbit,Love it,
TheHobbit,that's friggin kool,
TheHobbit,Tolkien Podcast: Elrond vs Gil-Galad or Which has the best claim to Kingship,
TheHobbit,What’s bilbo meant to do?,He is hired as a burglar but after listening to the audio book I can’t for the life of me figure out what’s he supposed to do. He makes a point with the dwarves/dwarfs that he can’t possible burgle the entire hoard.
TheHobbit,"Purchased for my brother's b-day, the fit is perfect!",
TheHobbit,Some mini book keychains I make. Absolutely love The Hobbit one!,
TheHobbit,The Most Powerful and Iconic AXES Of Middle-earth! | Middle-Earth Lore,
TheHobbit,"Found the Grail - ""The Hobbit"" in Latin",
TheHobbit,"Got this as a Bday present for my brother, He does 50-mile runs for ""fun"". he likes it as much as I do!",
TheHobbit,"Got this as a Bday present for my brother, He does 50-mile runs for ""fun"". he likes it as much as I do! 🤞🏻😊",
TheHobbit,"Just finished reading Chapter V ""Riddles in the Dark"" with my 6 year old daughter.","I have read countless chapter books with my 6 year old and have been waiting to read her the Hobbit, one of my favourite books. At the end of Chapter 5 when Bilbo jumps over Gollum to escape, she cried real tears feeling so sorry for Gollum. ""All Gollum wanted was the gift from his grandmother and he is so sad living in the dark cave""

Fun perspective through the eyes of a kindergartener."
TheHobbit,One of my absolute favorite purchases ever.,
TheHobbit,"Part of the video: Darkening of Valinor, and the forge of Fëanor, who first started to create weapons in holy land",
TheHobbit,Let's Talk Honestly About THE RINGS OF POWER | Amazon Show Discussion,
TheHobbit,Hobbit M4 Book Edit,I'm looking for a link to the Hobbit M4 Book edit but I'm not having any luck. Can anyone point me in the right direction?
TheHobbit,something feels wrong...,
TheHobbit,"Topographic map of middle earth inside a hollowed out copy of the hobbit, pretty proud of this one :)",
TheHobbit,HI,hi i am new here. i like the hobbit so much. I am a forest elf of the north. my name is lumaris.
TheHobbit,we finally finished our LOTR coverage this week with The Hobbits: Desolation of Smaug and The Battle of the Five Armies! Please listen if you’re interested:,
TheHobbit,hello i´m new here,my favorite movie
TheHobbit,This Hobbit/LOTR fan is very happy!,
TheHobbit,[Art] I made a book cover for The Hobbit,
TheHobbit,Find at a local used book store,
TheHobbit,"Rhosgobel, my second Hobbit themed fish tank! This is home to two Mollys, Opal and Freckles!",
TheHobbit,The Hobbit Being Adapted Over 3 Movies instead of 1 Didn't Hurt it as Much as how that extra time was used.,"Disclaimer: For any direct references to the book, I am relying mostly on memory and a quick google search to confirm, feel free to correct me in the comments if I make an incorrect claim about something that was or wasn't included in the source material. 

I recently rewatched Peter Jackson's The Lord of the Rings and The Hobbit trilogies and while, yes, The Hobbit movies were of substantially lower quality than the LOTR movies, I found myself unbothered by the idea of stretching the comparatively shorter source material over 3 movies. This stretching a roughly 300 page book into 8 hours of film (compared to each individual book in the LOTR trilogy being substantially longer and getting 3.5-4 hours of film in each of their extended editions) is a common criticism I have seen in my admittedly limited exploration into thoughts/reviews of the movies, however I believe that the increased length was not as much an issue compared to how that extra screen time was used.

One of the major additions that I thought enhanced the films was the expansion of the plotline with Sauron as the necromancer in Dol Guldur. In the book Gandalf says he originally acquired the key to Erebor from Thrain who was being held captive by a “Necromancer” in Dol Guldur, and is not mentioned much after that. In the films there is a whole plot line throughout the last 2 movies with Gandalf and the other members of The White Council investigating and combating the threat of Sauron at Dol Guldur which is not included in the original book. (Although I do think these events were written about by Tolkien retroactively) I thought this plotline's inclusion actually benefited the films, it helps contribute to the story in the LOTR movies more directly and helps flesh out Tolkien's vast world for those only familiar with the movies even more.

Unfortunately a lot of the additions in the Hobbit movies only end up being dramatic spectacle that don’t serve strong narrative purposes (for example, the barrel scene in The Desolation of Smaug being much more drawn out compared to its equivalent text.) If instead, more of the extra screen time these films got was spent on subplots that deviated from the source material,  but add to and expand Tolkien's incredible and massive world to those unfamiliar with the source material, I believe that these movies would be viewed much more favorably. Unfortunately most of the added content in these movies is mere eye-candy."
TheHobbit,Hobbit door wreaths made by me :),
TheHobbit,Peter Jackson spy in a basket scene in the,"In  The Hobbit The Desolation of Smaug is a deleted scene where Peter is a spy in a basked in Laketown and makes some bird noises, 

I saw this scene on YouTube few years back but cant find it anywhere, does someone know where I can see it?

[https://peter-jacksons-the-hobbit.fandom.com/wiki/Fram\_Watchman](https://peter-jacksons-the-hobbit.fandom.com/wiki/Fram_Watchman)"
TheHobbit,What Happened In ISENGARD Before &amp; After Saruman? | Middle Earth Lore,
TheHobbit,Why We Fight For The Shire,
TheHobbit,[OC][Fanart] Bilbo Baggins in front of his Smial - Watercolor mixed-media,
TheHobbit,"Arwen Nightbreeze, by Ina Wong",
TheHobbit,Wilhelm scream in Unexpected Journey,Who else feels that it wrecked the feel of Middle-earth? It made the movie seem modern instead...
TheHobbit,Smaug by marion bouzer,
TheHobbit,obsessing over the hobbit 1977 animation audio,
TheHobbit,Tolkien Fan Art,[removed]
TheHobbit,where's the lie though,
TheHobbit,I see,
TheHobbit,Legolas and Tauriel by ramida-r,
TheHobbit,The Hobbit Timeline,[removed]
TheHobbit,the asseating of Smaug,
TheHobbit,I am so pleased with my purchase,
TheHobbit,Help me find a user from the old Hobbit KOM game,"Once upon a time, there was a game called The Hobbit: Kingdoms of Middle Earth. It was a simple game, build a city, grow an army and pvp to level up. Rewarding and fun, but that's not why people flocked to it. What they went for was the Global Chat, a Giant entry point for anyone who was on the game at the same time. This was 9 years ago. The game has well and truly shut down at this point. 

To get to my point, my user name on this game was TheLoneWolfTLW. I remember that I was on a Thorin server. I am hoping to reconnect to my closest friend on that server - a user called Slavegirl. 

I know this one is a long shot, but it's been nearly a decade and I still think about them sometimes.
So, if by some miracle, the user who used to be Slavegirl, you find this, I'd love to reconnect.

TL:DR - TheLoneWolfTLW is looking for Slavegirl"
TheHobbit,The Hobbit Film Trilogy,"Just popped into the hobbit sub to talk about Thorin’s Party.  I know this is likely a dead horse, but did anyone else feel like the party looked more like Cosplayers of LOTR fandom then actual dwarves?  With the exception of course of Balin and Gloin who I personally thought looked *perfect*

Also, what’s up with casting a baby faced actor for Thorin Oakenshield?  Am I crazy or does this guy have a baby face??"
TheHobbit,Does such a FanFiction exist?,"I, like most hobbits, am a bit of a homebody and I love the idea of reading about life in the Shire. No adventures, or small ones if there are some (like a nice hike in which the hikers are back in time for dinner), even very little plot. I just want to know, from the perspective of a hobbit who is living their best merry life in the Shire, what it’s like there. Does such a fanfiction exist? Or am I destined to write it myself? 
Thank you, have a good day!"
TheHobbit,Is this a spoiler for The Hobbit?,"I'm on chapter 4 of The Hobbit, and while I was looking for a audio book of chapter 4 on YouTube, a video shows up in the search results which said something like ""Study with Bilbo Baggins in his house"". They included the houses name but I forgot it. I do remember the houses name being different from Bilbo's Hobbit Hole. Now I'm concerned I spoiled myself with Bilbo getting a new house. Is this a spoiler?"
TheHobbit,Yellowstone (TV show) and Hobbit (movies) soundtracks strangely similar at times?,"Recently started watching this show called Yellowstone, and some of the instrumental background music throughout the episodes catch me off-guard. Some of them sound strangely similar to music from the Hobbit movies, but I can’t name which…

If you search up “Adagio” by Brian Tyler, you should really hear what I’m talking about. Jump to 0.29 seconds or so. 

I’m sure it’s normal for soundtracks to sound similar, as there are so many movies and TV shows out these days, but I’m still baffled for some reason. Maybe this is a common sound often sampled for film?"
TheHobbit,Like it Moria Balrogs Team Logo,
TheHobbit,Legolas and Tauriel by ramida-r,
TheHobbit,Lord Of The Rings - [Lo-Fi] - [Ambient] Chill Hop &amp; Relax,
TheHobbit,Gandalf Funko looks awesome,
TheHobbit,Mobile Game – The Lord Of The Rings: Heroes Of Middle Earth,
TheHobbit,Go bilbo,
TheHobbit,Painting hidden in gilt edges,
TheHobbit,thorin oakenshield,
TheHobbit,the hobbit trilogy vs LOTR,"I love LOTR, don’t get me wrong. but as time passes, I have grown fonder of the hobbit trilogy. I grew up reading the hobbit and watching the animated movie but never enjoyed the trilogy as much as I have now. I will now choose it over LoTR when reaching for my collection. anyway else feel the same?"
TheHobbit,Love it Sauron Did Nothing Wrong,
TheHobbit,"""Smaugy Bottom Boy"" | Quincy | FoxTrot Comics by Bill Amend",
TheHobbit,"Ah nostalgia, anyone else play this growing up?",
TheHobbit,"Watch ""Lotr lord of the rings Gandalf the white...",
TheHobbit,In a Pixar movie lol,
TheHobbit,Lotr lord of the rings Gandalf the white Funko pop exclusive box lunch review,
TheHobbit,What’s the motivation of Bilbo Baggins to go to the adventure?,"Hello Reddit, 
I’m a huge fan of The Hobbit and other of Tolkien’s works.

Soon I’ll change my life in a way that will affect my routine and my habits. I cannot get really into details but for me it’ll be an adventure that I’m seeking for.
In the last few days, I get some fears and thoughts about my transition that make me doubt my own motivation.
Like Bilbo Baggins I have (for now) a static life yet very easy and steady which I really enjoy and sometimes I wonder why the hell I even want this transition when I have everything here?

So, my question is what’s the motivation of Bilbo to go to the adventure? Why he even left The Shire? And please don’t give me that Gandalf chose him thing…"
TheHobbit,Observation I made about the Dwarf Killi,Does anyone else notice and finds it kinda odd in The Hobbit series movies how much Kili is always so happy go lucky and chipper all the time when dwarves are usually grumpy??? Would they not shun him for his positive demeanor??? Please correct me of I'm wrong and give me a detailed reason thank you everyone!!!!
TheHobbit,smaugggg,
TheHobbit,smaugggg,
TheHobbit,I would like everyone to know this masterpiece exists,https://youtu.be/ECP1G413d_M
TheHobbit,Love it Middle Earth'S Annual Mordor Fun Run One Does Not Simply Walk,
TheHobbit,Log into Facebook,
TheHobbit,"White Hand Orc, tattoo by Felipe Kross",
TheHobbit,What Was SARUMAN's Plan If He Defeated Rohan?!? | Middle-Earth Lore,
TheHobbit,Founding of the newly awakened Elves by Oromë in the woods near lake Cuiviénen.,
TheHobbit,he's just that good,
TheHobbit,he got away with it lol,
TheHobbit,Tolkien Podcast: The Identity of the Third Possible Dark Lord Revealed,
TheHobbit,Carmaky - Mining Industry Project Management &amp;amp; Technology,
TheHobbit,The Trolls’ campfire from one of Tolkien’s sketches,
TheHobbit,Like it Moria Balrogs Team,
TheHobbit,Shoutout to u/thedenvergamer for personalizing this poster for my Hobbit edit of your own volition! (original art by Javier Medellin Puyou),
TheHobbit,you shall not pass Gandalf the Grey,
TheHobbit,I drew my partner as a blissful hobbit enjoying some home brewed coffee,
TheHobbit,"Lord of the Rings, back tattoo by El Mago from Valencia, Spain.",
