subreddit,title,selftext
TheHobbit,Book Club,"This is one of my favourite chapters in the book. 

[https://www.youtube.com/watch?v=SmhpiOygxmk&amp;list=PLNJ\_lmPdbHJwgfkE3jHZtidBmqg\_DQk\_7&amp;index=3](https://www.youtube.com/watch?v=SmhpiOygxmk&amp;list=PLNJ_lmPdbHJwgfkE3jHZtidBmqg_DQk_7&amp;index=3)"
TheHobbit,Does anyone remember there being a group of 3 college students that raised money through social media to go be extras in The Hobbit? I think they called their journey “Road to the shire”,[removed]
TheHobbit,History of Thorin,"Here we have a history of the character Thorin Oakenshield, before that fateful visit in the Shire.

&amp;#x200B;

[https://www.youtube.com/watch?v=CwsoAbtSTNY&amp;list=PLNJ\_lmPdbHJzL\_fXL05-vNrttgMT4tYU8&amp;index=1&amp;t=2s](https://www.youtube.com/watch?v=CwsoAbtSTNY&amp;list=PLNJ_lmPdbHJzL_fXL05-vNrttgMT4tYU8&amp;index=1&amp;t=2s)"
TheHobbit,Who would you have wanted to direct a Hobbit movie?,"

[View Poll](https://www.reddit.com/poll/r0kblo)"
TheHobbit,Would Sam Raimi be a good choice to direct the Hobbit?," In 2007 Sam Raimi was considered to direct the Hobbit but lost it to Gullermo Del Toro but what if he directed the movie, How different would they be to the ones we got? Would it be better or worse? I would've like to see Bruce Campbell as Bard."
TheHobbit,Christmas decoration anyone?,
TheHobbit,Ever wondered about Smaug before The Hobbit?? Well it gets covered here!,
TheHobbit,I made samwise gamgees' house😊,
TheHobbit,The Hobbit: Duology Edition,
TheHobbit,The Oakenshield :D,
TheHobbit,You are Gandalf and Bilbo just left his house keys on your hands before going with the dwarves. What do you do?,"I just wondered, does Gandalf wash the half-eaten breakfast dishes? Closes the windows? Anything?

Edit: please excuse my english, not my mother tonge."
TheHobbit,Different Actor for KILI in the first Hobbit?,[removed]
TheHobbit,It was the perfect addition for my room!,
TheHobbit,I made a mini hobbit-hole!,
TheHobbit,Questions- need answered,"I have a couple of questions that I’ve been thinking about.

1. How did Smaug sustain himself if he was in in the mines?

It seemed like he was trapped there, due to him breaking the building as he escapes (see gold Smaug).

2. Is there any indication of the gold Smaug is protecting the same metal used to make the one ring?"
TheHobbit,Bilbo and Smaug,"So I'm rewatching The Desolation of Smaug, and I had a question. Did Bilbo wake Smaug by disturbing the pile of gold? Or was Smaug already awake? The last scene of An Unexpected Journey was Smaug's eye opening, so was he just sitting there till Bilbo showed up? Kinda a small detail but I found the possibility of Smaug destroying Laketown being Bilbo's fault directly interesting."
TheHobbit,"Out of Those who've read The Hobbit, and watched the movies, which did you find better?","

[View Poll](https://www.reddit.com/poll/qvo2qz)"
TheHobbit,An old woman just complimented my shirt.,
TheHobbit,I’m looking for a FanFiction that I can’t seem to find.,"So the part I remember most is at the beginning and it’s that Bilbo, Frodo, and Gandalf are on the boat with the Elves and they’re sailing away. Gandalf and Bilbo are talking and Bilbo says he regrets not hitting Thorin over the head or something of the like. Then Bilbo leaves to retire to his cabin and sleep. But as he sleeps Gandalf sends him back in time to redo the whole quest. Somehow Thorin remembers. But that’s all I can recall. Does anyone know of the FanFiction I’m talking about or something similar?"
TheHobbit,Research for a YouTube video!,"Hello everyone!
I’m looking for the answer to the following question for potential use in a video I plan on making on The Broken Sword YouTube channel…
 (So if you answer I will assume you are okay with me potentially using it in the video - (with credit))

What are the reasons you fell in love with Tolkiens works/world?"
TheHobbit,"When I was 11, I was in a children community theatre’s musical production of The Hobbit. I was a spider&amp;the auctioneer hobbit. All of our costumes, sets, props, etc. were so legit except for the fact that they made the dragon a GIANT Elvis head instead? And never referenced this? Still geeks me out.",
TheHobbit,Have you wanted to know more of GIMLI's life before and after the War of the Ring? (Including what he was doing during The Hobbit) Then check out this video :D,
TheHobbit,"I have this page in my book of The Hobbit, however my friend doesn’t. I can’t find anything about it online. Any help on this?",
TheHobbit,"New Celtic composition - The Fallen Kings of Arnor Arnor, the sister kingdom to the southern realm of Geriad, was a kingdom of Men located in the land of Eriador in Middle-earth. The most famous king of Arnor was its second king Isildur. In the War of the Last Alliance, Isildur cut the One Ring",
TheHobbit,Difference between UC Glamdring and MC Glamdring,
TheHobbit,This is adorable! I purchased for Christmas! I am very happy!,
TheHobbit,Why is there do dwarf book?,
TheHobbit,I’m very happy with my new prints:),
TheHobbit,"Perfect for me as a big LOTR fan, wore it to work and it was a hit",
TheHobbit,"Perfect for me as a big LOTR fan, wore it to work and it was a hit",
TheHobbit,The Hobbit Squad now available as nfts. Get your favorite hobbit character and also get a free hopping Gollum once you own any character from the collection..,
TheHobbit,Deal: Unity Buys Peter Jackson's Weta Digital For $1.6B,
TheHobbit,I am proud of this fabulous work of art !,
TheHobbit,The mysterious thrush bird,[removed]
TheHobbit,Thorin,[removed]
TheHobbit,An update to The Hobbit - The Battle of the Five Edits,[removed]
TheHobbit,A quick update for The Battle of the Five Edits!,[removed]
TheHobbit,This is just perfect,
TheHobbit,The Full Story of GIL-GALAD! | Middle Earth Lore,
TheHobbit,My first ever Fanedit got approved on IFDB! Presenting: The Hobbit - The Battle of the Five Edits!,
TheHobbit,Signed Collectable Hobbit Stamps - Sir Ian McKellen,[removed]
TheHobbit,"My friends Frodo and Gandalf cosplay, it was a Halloween competition think that the Frodo outfit was great!",
TheHobbit,"J. R. R. Tolkien - The Hobbit or There and Back Again | Read by Andy Serkis (10h, 24m, 36s)",
TheHobbit,At your service :),
TheHobbit,The Hobbit (French Horn Cover),[removed]
TheHobbit,Squid Game or French Horn Game? #shorts,[deleted]
TheHobbit,"I created a Mega-Mix Fanedit of the Hobbit. It will be approved on IFDB later today, here's a trailer for a quick introduction!",
TheHobbit,"I created a Mega-Mix Fanedit of the Hobbit. It will be approved on IFDB later today, here's a trailer for a quick introduction!",
TheHobbit,The Hobbit (Horn Tribute Cover),[removed]
TheHobbit,Lord of the rings,[removed]
TheHobbit,"Love you Bros, me, new member",
TheHobbit,A Celtic composition inspired by a haunted forest from the world of J.R.R Tolkien.,
TheHobbit,Dori - a 28 mm miniature painted by me :),
TheHobbit,"My Lotr inspierd Elven Shields in two Color wariants, One for Noldor and one for Sindar.",
TheHobbit,First Time Read Thru Pal?,[removed]
TheHobbit,How would you have made The Hobbit as a trilogy of films?,"Without saying it should’ve only been one or two films, Does anyone think a true adaption could be made out of three films? How could it be done in the best way?"
TheHobbit,Bilbo Baggins,"“We are trapped!” they groaned. “This is the end. We shall die here.” But somehow, just when the dwarves were most despairing, Bilbo felt a strange lightening of the heart, as if a heavy weight had gone from under his waistcoat.

The context here is that smaug destroyed the part of the mountain in which the back door was present inside which were Bilbo and the dwarves and they had no way to escape out. Why do you think in such terrible situation did Bilbo feel a ""strange lightening of the heart""?"
TheHobbit,Does anybody know where you can watch The Hobbit 1977 or find it cheap on DVD?,[removed]
TheHobbit,Are there any good The Hobbit monologues?,"I need to do a monologue for my drama class, and im wondering if there are any good monologues in The hobbit? I was thinking about doing the Smaug speech before he flew out of the mountain and the movie ended (idk what that particular movie was called). But are there any other good ones? Any would be appreciated :))"
TheHobbit,28mm miniature of Ori :),
TheHobbit,Keep Calm and don't tell the Elf,
TheHobbit,Why did Gandalf not tell Thorin about Thrain?,[removed]
TheHobbit,What Happened To The ENTWIVES? | Middle Earth Lore,[https://youtu.be/Pq4G0mqTcjo](https://youtu.be/Pq4G0mqTcjo)
TheHobbit,M4 hobbit edit deleted,[removed]
TheHobbit,What does Bifur say to Bilbo in the extended cut of An Unexpected Journey?,[removed]
TheHobbit,Thorin began to see Bilbo as an equal,"I've been rewatching the hobbit (extended) a couple of times now and something I noticed Is how Thorin grows much more affectionate towards Bilbo over the movies. In the desolation of Smaug, when Bilbo is missing Thorin looks concerned, he also relies on Bilbo to release them from Thranduil's Halls.

*Balin: ""A deal was our only hope""*

*Thorin: ""Not our only hope""*

Bilbo also vouched for Thorin In lake-town. 

In the battle of the five armies. Every dwarf Is told to search the golden halls for the Arkenstone, yet Bilbo remains by Thorin's side without any obligation. In the throne room, Thorin begins to question the loyalty of his kin, not Bilbo's, you can also see how Bilbo stands on equal ground by Thorin's side rather than next to Balin and Dwalin who stand 3 steps lower.

This may just be the movie, but Bilbo Is also the only one who can temporarily ease Thorin's disease as you saw from their conversation about Bilbo's share. In the armory, Thorin gives the mithril tunic to Bilbo rather than wearing It for himself, he also expresses that he's been betrayed, being open to bilbo about It means he trusts him fully. 

""*This Gold, Is* ***Ours***"" Despite Bilbo not directly being kin, and was only granted a ""share"" according to the contract.

I do believe Thorin would've asked Bilbo to remain by his side were the Dragon's sickness not at play and had he not died"
TheHobbit,Contract Request,[removed]
TheHobbit,It looks great in my wall! It’s more perfect than I imagined.,
TheHobbit,I painted Gandalf and The Lonely Mountain! Hope you guys like it!,
TheHobbit,The Eagles,"I know this may sound stupid but why couldn't have Gandalf just asked the eagles to pick them up and drop to Rivendell and then straight to the castle which could have saved them from so much in the trip.
Also, haven't read the books so not sure and I know if it would have happened , Bilbo wouldn't have got the ring or they would have come to know about the Necromancer but still if anyone can answer."
TheHobbit,What Are The BARROW-WIGHTS? | Middle Earth Lore,
TheHobbit,28mm miniature :),
TheHobbit,Ghosts singing from Valhalla,
TheHobbit,"[HELP] Portuguese edition of the book ""The Hobbit"""," Hello!

I'm graduating in translation studies in Brazil and I need the Portuguese first edition of the book ""The Hobbit"", translated as ""O Gnomo"". If anyone have the file of the book in .pdf, or the scan, it would help me a lot. I need it to my final paper. Thank you for your attention."
TheHobbit,this is one of my favourite,
TheHobbit,Lake town - Fan made environment,
TheHobbit,This print is amazingly perfect.,
TheHobbit,The new decoration of our house! I like it!!!,
TheHobbit,Just sharing my blog post about Bofur :) (tutorial and nerd talk),
TheHobbit,"""Pippin's Song"" Low Whistle Solo",
TheHobbit,The Full Story of BOROMIR! | Middle Earth Lore,
TheHobbit,LOTR Trilogy 4K for $59 and Hobbit Trilogy 4K for $59 on Amazon,
TheHobbit,100 Whistles Mountains Cold Collaboration!,
TheHobbit,How did the Mirkwood elves managed to create so many weapons and armors for their whole army?,"I don't see how they managed to make all that stuff, when we see their homes we don't see a single forge. Also where do they get the material to craft all this?"
TheHobbit,Was thrain originally in the 2nd hobbit movie?,"So I’m rewatching the hobbit movies, and I just got to the part where Gandalf relieves the spell on thrain. But, for the life of me, i do not remember thrain being recovered. Is this a new addition to the movie or is my memory failing me… i couldn’t find anything on google."
TheHobbit,"Lots of great gifts for my family, I hope they like it!!!",
TheHobbit,"FOF Exclusive: Isildur is one of the main characters, beginning circa episode 3 in season 1",
TheHobbit,Home - cannabisflowerss.com,
TheHobbit,"The ""Whistle"" Mountains Cold",
TheHobbit,Into The Rising (LoTR inspired short),
TheHobbit,My husband likes it a lot..!,
TheHobbit,The Hobbit,
TheHobbit,This was a purchase for my family and I hope everyone will love it!!,
TheHobbit,it’s definitely my new fav tees!,
TheHobbit,Bilbo and dwarvs relationship,[removed]
TheHobbit,Why doesn't Peter Jackson split the Hobbit into two movies instead of a trilogy?,[removed]
TheHobbit,An attempt was made to paint the City of Dale.,
TheHobbit,Was It Right to Add LURTZ into The Lord of the Rings? | Middle Earth Lore,
TheHobbit,홀덤 사이트 - 온라인홀덤- 메이저홀덤사이트 - 홀덤월드,
TheHobbit,Elven Warrior also built by my dad,
TheHobbit,Aragorn’s Tomb built by my dad,
TheHobbit,I got to make a Smaug cake recently!,
TheHobbit,"I made Bilbo's Housecoat from ""The Hobbit"" (quite possibly the best part of the movies, honestly). It was a labor of love, and I feel like there are many in this group who would appreciate the colors, the textures, the Tolkien references, and possibly the corgi!? It premieres tomorrow @ 12 CET",
TheHobbit,These prints turned out amazing!,
TheHobbit,CDL TRAINING FOR TRUCK DRIVING IN VIRGINIA - Shippers Choice -,
TheHobbit,"Well I did a little drawing of the shire. I think it was good enough to post it in here, what do you think??",
TheHobbit,Drew this 1977 Gollum for Inktober!,
TheHobbit,This is one of the new favorites!!,
TheHobbit,The art looks so good! I got a frame for it today 😎,
TheHobbit,Smaug leaving Erebor without liquid gold/chasing Dwarves - A fun project to be as faithful to the book as possible,
TheHobbit,Smaug leaving Erebor without being liquid gold/chasing Dwarves - A fun project to be as faithful to the book as possible,
TheHobbit,What factors define the nature of a hero in the hobbit? This is for an essay and looking for different ideas. Thanks guys!,
TheHobbit,It was the perfect addition for my room!,
TheHobbit,THE BATTLE OF HELM'S DEEP (The HORNBURG) | Book vs Movie Differences | Middle Earth Lore,
TheHobbit,The day Bilbo changed the dwarves' lives,
TheHobbit,It was the perfect addition for my room!,
TheHobbit,The connections between the Hobbit Trilogy and the LOTR trilogy.,"Just curious as to what everyone thinks about the connections between The Hobbit BOTFA and the beginning of Fellowship of the Ring? While I personally really like the call backs and connections the film made to the OG trilogy, I’m aware that a lot of people don’t like them. So yeah, what do you think of them?"
TheHobbit,a most unexpected party,
TheHobbit,I just realized battle of the five armies is 7 years old.,[removed]
TheHobbit,"My drawings of Thorin, Fili, and Kili🍂Done in pencil🌿Had lots of fun doing these",
TheHobbit,Thought y’all would appreciate my new print:),
TheHobbit,Far Over the Misty Mountains Cold - Ocarina Cover,
TheHobbit,Fuckin awesome artwork!!!!,
TheHobbit,A Day in the Life of JRR Tolkien's Publisher!,
TheHobbit,Who Was The Skin-changer BEORN? (And THE BEORNINGS?) | Middle Earth Lore,
TheHobbit,Anyone know more about this?,
TheHobbit,Want to watch movies cant buy them,[removed]
TheHobbit,Got lucky it was 3 movies for 15$ also there were double of TDOS and TBOTFA but only one unexpected Journey. I got the only one.,
TheHobbit,Some pictures from my Hobbit/LotR marathon this weekend,
TheHobbit,The Hobbit: The Battle of the Five Armies is 37% off,
TheHobbit,"They Hobbit trilogy is great but interior to the original trilogy, and that's okay.","Just got done watching all three Hobbit movies with my wife and they were great! No, they didn't match the original, but that's not really an indictment of the films. The Lord of the Rings trilogy is arguably the greatest movie trilogy ever made, best fantasy movies ever made, and probably the best book to film adaptations ever made 

They were landshark films that changed the industry. They're still reference level for costumes, makeup, practical effects, set design, etc. The Hobbit films were never going to live up to that. But then again no other fantasy films can compete with LotR either. Hell very few non-fantasy movies can go toe to toe with LotR and not get embarrassed.

And considering the dogshit that's being made nowadays, im grateful that Peter Jackson provided the world with nearly 20 hours of fantastic adventure to get lost in and escape from the world. Hell, nobody is even trying to make great high fantasy movies. It's all gender swapped franchises or comic book films. Yuck.

Anyways, I think it's silly to shit on these movies because it's underserved. The Hobbit movies can be inferior to the OT but still great fun, they're not mutually exclusive."
TheHobbit,"Perfect for me as a big LOTR fan, wore it to work and it was a hit.",
TheHobbit,"CDL Jobs Dedicated-Local To Bakersfield, CA 10K Sign on Bonus",
TheHobbit,"OLD 2014 Tauriel sketch. This is probably the only sketch which was not destroyed(my dad destroyed other drawings by mistake😢).It was not one of the best, because this superrealistic favorite was destroyed, but I have good memories. What do you think about it? Say what you want🏋️‍♀️",
TheHobbit,Just picked up the first hobbit book before watching the movies,[removed]
TheHobbit,Hobbit fan Survey for university assignment,[removed]
TheHobbit,"[OC] Sorry for calling you out like this, Bofur...",
TheHobbit,The Full Story of the 13 DWARVES OF THORIN'S COMPANY! | Middle Earth Lore,
TheHobbit,"Let’s see… yes indeed..! There are moon letters here - runes that can only be seen when Da Moonlight shines behind them! “…Stand by the grey stone when the thrush knocks, and the setting sun with the last light of Durin’s Day will shine upon the keyhole,”",
TheHobbit,I made a meme.,
TheHobbit,"Hi, everybody! After so many years of avoiding LoTR because of my trauma caused by Gollum, I’ve finally watched all of the movies up and became an instant fan of them! I naturally created my persona if I were from Middle Earth. Meet Narqueriel, an elf who got adopted by a hobbit! Hope yall like it.",
TheHobbit,My parents b-day gift to me. They are the best!,
TheHobbit,One can dream of a remake... With Michael Sheen,"One of the things that really pissed me off about the movies (ugh, plural, such a nightmare) was that I considered Martin Freeman The Best choice for playing Bilbo, and I felt robbed of enjoying that experience. But after watching Staged and Michael Sheen's comment (surely just a joke) about Martin stealing the role from him, it made me picture him as Bilbo, maybe in a mini series or something that could really portray the story as it should be. So now I'm trying to manifest that into existence because let's be honest, Sheen would be a GREAT Bilbo Baggins, he even has the curls for it. 

If anyone here has the money to make it happen, you know what you have to do. It would be considered humanitarian aid, I'm sure."
TheHobbit,Middle-Earth's No.1 Dating Show!,
TheHobbit,How to get extended editions of the hobbit to pull up in premier pro?,[removed]
TheHobbit,why didn’t the dwarves if erebor go to the iron hills?,[removed]
TheHobbit,Gandalf in Books vs Movie,"From what I’ve gathered, Gandalf has a conversation with the dwarves that at some point prior to the adventure, he goes on a fact-finding mission and learns of Sauron (The Necromancer). In the movies, we don’t see this (as far as I know) happening before the adventure. 

That said, I also know that the movies ≠ the books in terms of timeline and details. Is it absurd to think that this fact-finding mission is what we see take place in Desolation of Smaug, and they rearranged the placement of those events as a way to help explain Gandalf’s lack of participation in the books between Mirkwood and The Battle? Or is that explained in the book/movies separately and I just missed it?"
TheHobbit,Question about Thranduil’s Kingdom,"I recently read that after the War of the Ring, Thranduil changed Mirkwood’s name to Eryn Lasgalen, so when I talk about Mirkwood, should I be calling it Eryn Lasgalen instead?"
TheHobbit,"My attemot at The lonely Mountain Map, it aint perfect, but its honest work",
TheHobbit,LOTR themed donuts,
TheHobbit,Seamless body for Gollum 1/6 figure,
TheHobbit,Middle-earth: Shadow of War – Cinematic Trailer (Remastered 8K 60FPS),
TheHobbit,Happy World Hobbit Day - Have Some Hobbits!!,
TheHobbit,The Hobbit fan survey,[removed]
TheHobbit,"Why does Bilbo say ""West at Bree"" in the meeting with gandalf in an unexpected journey",[removed]
TheHobbit,Where to pause the hobbit extended editions?,"So I want to start watching the hobbit extended editions, but unlike the Lord of the Rings extended, the movies are all on one disc. If I wanted to split the each hobbit movie viewing in two, like they are with Lotr, where would be the ideal place to do that?"
TheHobbit,Where can I see a comparison of the hobbit at 48fps?,So I bought the 4k 24fps version and it looks amazing though it only has the one fps setting. But I haven’t had the opportunity to see the 48fps that everyone says looks like a soap opera. I tried to YouTube it but there wasn’t any options surprisingly.
TheHobbit,Bilbo let me borrow his sword,
TheHobbit,Nazgul (Talion) freed from Sauron's rule,
TheHobbit,Understanding The URUK-HAI | Middle Earth Lore,
TheHobbit,This art print is BEYOND perfect!,
TheHobbit,Looking For Music From The Nicol Williamson Hobbit Record Set,"&amp;#x200B;

https://preview.redd.it/0o0ev62bego71.jpg?width=500&amp;format=pjpg&amp;auto=webp&amp;s=cc18207da2103449c9c08bd95659d83938658af0

I've looked off and on for years to find the music used on The Hobbit records that are performed by actor Nicol Williamson. The opening is this song by Bob Stewart: [https://youtu.be/gyUM6RXYUwI](https://youtu.be/gyUM6RXYUwI)

The other music tracks on the Williamson recordings are not from this record, but most likely from the same publisher, Argo, and from around the mid 70s.

There must be someone out there who has come upon a track list, or was maybe even involved in the making of this record set - I would love to be able to create a music soundtrack of this amazing piece of my childhood."
TheHobbit,Sauron abandoned Shelob,
TheHobbit,One Of The Seven - Tolkien fan fiction film (24 min),
TheHobbit,Take a look! A Smeagol in hand.,
TheHobbit,Something to make you laugh - The Hobbit but it's written by an ai,
TheHobbit,Absolutely beautiful! Bought several of these and they were all stunning. ❤️,
TheHobbit,"""The Hobbit"" Timeline","Okay, I just finished watching the Hobbit film trilogy again and I can't shake something said near the end of the movie. When they're auctioning Bilbo's things, they say they assumed him dead as he's been gone for 30 months+. The Hobbit calendar is basically on par with our human one, with months having 30 days more or less and the entire year being 365 days, so this means that the events of The Hobbit took place over 2 1/2 years. This honestly doesn't make sense to me at all, but I haven't read the book, so that could be why I'm missing information. The story to me feels like it takes place over 3-5 months, max. Was this just a movie mistake or is the story's timeline actually that long? And if it is that long, could you explain where all that time comes from?"
TheHobbit,LOTR and Hobbit Knowledge Quiz,"Hey, I wanted to share with you a quiz about LOTR and Hobbit. It features 20 questions from the movies as well as from the books. I think that I've managed to come up with a pretty hard quiz and I hope that you will enjoy it. You can test your knowledge here - [http://www.popculture-quiz.com/lotr-and-hobbit-knowledge-quiz/](http://www.popculture-quiz.com/lotr-and-hobbit-knowledge-quiz/)"
TheHobbit,Sauron enslaved two Asian Women Warriors,
TheHobbit,Why is there a lot of hate towards The Hobbit films?,"I’m fairly new to the online scene of the movies and while I was watching some videos on it on YouTube, the comment section was filled with people saying how horrible the films are. I loved the films, to me they felt like a breath of fresh air compared to LOTR trilogy."
TheHobbit,Anyone else have their copy reserved? Looks to be a beautiful edition with illustrations by the man himself.,
TheHobbit,one does not simply walk !,
TheHobbit,Sauron enslaved Isildur,
TheHobbit,This is one of the best purchases I’ve ever made!,
TheHobbit,"I made a 2hr Hobbiton-inspired ambient track, with bits of soundtrack sprinkled throughout (and maybe an Easter egg or two). Enjoy!",
TheHobbit,Lord of ring,
TheHobbit,The Hobbits After The Lord of the Rings!,
TheHobbit,"Gollum / Sméagol, which one? 1:6 action figure releasing now",
TheHobbit,Willow (1988) Is BETTER Than the Hobbit and the Lord of the Rings,
TheHobbit,A perfect amount of uniqueness to the piece which makes it amazing...,
TheHobbit,This is such a beautiful piece!! better than i imagined😊,
TheHobbit,An Unexpected Journey…,
TheHobbit,Sauron enslaved Nelm Hammerhand,
TheHobbit,Asmus Toys: Gollum/Smeagol 1/6 scale figure is coming,
TheHobbit,The Wizard,
TheHobbit,The Second Breakfast Club,
TheHobbit,Sauron enslaved the King,[https://www.youtube.com/watch?v=qQSiGkamrqM](https://www.youtube.com/watch?v=qQSiGkamrqM)
